{
  "anonymous_arm_id": "ARM-A",
  "attempt_hash": "326503ff57bd36578c60522437f0c5657922c3eb17e9e9f71e557ebb325f4b55",
  "attempt_id": "EXP-CASE-006-ARM-A-R1-A01",
  "case_id": "CASE-006",
  "coverage_hash": "270df6912b0b165c2b1bb86457d19ef3967b08d722d4efbed2fffad0b184a712",
  "eligibility_hash": "c654b600fa9a018795e2cf7ad0adb63eb9359034b9176989bfac7a3769dfa724",
  "execution_kind": "REAL_CODEX",
  "observation_hash": null,
  "oracle_result_hash": "e9760d473b8cf75552e9934d3d6cf05d8c5746ae5f892dd138a7af14b82132bf",
  "oracle_status": "NOT_RUN",
  "primary_eligible": false,
  "process_evidence_status": "FAIL",
  "process_hash": "6aabcf54fb1a1367723c3378f2fb6da34cfeac1c5e8da50215dc69bae4c9b2a0",
  "repeat_id": 1,
  "robustness_status": "PENDING_CROSS_REPEAT",
  "run_hash": "c2ddf3349a1b0c257017138ce43e6e5a2bcc8a15cd1b503bbf948095216f4b13",
  "run_id": "RUN-EXP-CASE-006-ARM-A-R1-A01",
  "schema_version": "1.0.0",
  "subject_commit": "1cafef225ee413c8c190745e8c980b5fe917ec45",
  "workspace_commit": "475af6ca0e56d9f904b9aa40adb65164ad0bf436"
}
