{
  "anonymous_arm_id": "ARM-A",
  "attempt_hash": "68eb3af786937c77a8f54164e2a977ed85b886c09373bc20a917a6efae19c613",
  "attempt_id": "EXP-CASE-002-ARM-A-R2-A01",
  "case_id": "CASE-002",
  "coverage_hash": "b1cc190c67d42c4a7730872bf69eb2f5b2574320829f403ac7ef9333369a7e83",
  "eligibility_hash": "f0eaebaeb3a517182fd3053c7c97a2ca3640a9644cbd3fa5e29a5c6d2060ebf7",
  "execution_kind": "REAL_CODEX",
  "observation_hash": "248b9ef837c10ffffce23cf4411e50bc66e46d516ca42f2e3f97e5eb219466fa",
  "oracle_result_hash": "c5083f1b2088691c10634bf9755e80df7b9e7d2a74caced0dd6dc4035bd04e90",
  "oracle_status": "PASS",
  "primary_eligible": true,
  "process_evidence_status": "PASS",
  "process_hash": "2c8f068af8335f53f6b30bba7e1f4d7e465fa467f6bb9806093686788de12a73",
  "repeat_id": 2,
  "robustness_status": "PENDING_CROSS_REPEAT",
  "run_hash": "a355a11e76726c6c8a2d909d66c0466792e95d1e7e05cdd2ac08bbae6b82a876",
  "run_id": "RUN-EXP-CASE-002-ARM-A-R2-A01",
  "schema_version": "1.0.0",
  "subject_commit": "9e9cd7f5c60ae7bf5fc2c1371160c8aa30ec5004",
  "workspace_commit": "26dc47c1aef02276a7f3860fd8b7f6be0a19052e"
}
